{
  "head": {
    "link": [
      {
        "rel": "shortcut icon",
        "href": "{{return cwrapRoute !== '' ? '../' : './'}}favicon.ico",
        "type": "image/x-icon"
      }
    ]
  },
  "element": "cwrap-template",
  "text": "cwrapTemplate[body]",
  "passover": [
    {
      "element": "main",
      "style": "display: flex; flex-direction: column; gap: 56px; margin-top: 131px; padding-bottom: 104px; padding-inline: 39px;",
      "children": [
        {
          "element": "div",
          "style": "margin-inline: auto; max-width: 69.375em; width: 100%;"
        }
      ]
    }
  ]
}